{
  "$schema": "./2.0.schema.json",
  "schema_version": "platform-topology/2.0",
  "organization": "Aftergraph",
  "evidence_cut": "2026-10-02",
  "description": "Human-governed repository topology for the Aftergraph polyrepo platform. This file defines scope and ownership classes, not exact Git state. Exact heads are generated from GitHub by scripts/org-state-verify.sh. architecture_plane carries one of the seven permanent semantic planes or null for support systems; system_class carries the functional repository class and is never inferred into a plane.",
  "repositories": [
    {
      "name": "after-graph-governance",
      "canonical_branch": "main",
      "visibility": "public",
      "architecture_plane": null,
      "system_class": "governance",
      "role": "canonical-contracts",
      "lifecycle": "active",
      "owns": "Platform topology, cross-repo boundaries, contract registration and generated org-state mechanics.",
      "must_not_own": "Runtime authority, enforcement, execution, verification verdicts or any canonical domain truth owned by another repository."
    },
    {
      "name": "aie",
      "canonical_branch": "main",
      "visibility": "public",
      "architecture_plane": "authority",
      "system_class": "institution",
      "role": "normative-authority",
      "lifecycle": "active",
      "owns": "Portable institution, authority, delegation, lifecycle, budget and revocation semantics.",
      "must_not_own": "Runtime enforcement, authenticated sessions and secrets, agent execution, durable WorkGraph state or independent verification."
    },
    {
      "name": "trust-gateway",
      "canonical_branch": "main",
      "visibility": "public",
      "architecture_plane": "trust",
      "system_class": "enforcement",
      "role": "runtime-enforcement",
      "lifecycle": "active",
      "owns": "Fail-closed runtime admission, policy enforcement, approvals, secrets and action audit.",
      "must_not_own": "Authority semantics, mission planning, durable work, organizational knowledge or independent verification."
    },
    {
      "name": "runtime",
      "canonical_branch": "main",
      "visibility": "private",
      "architecture_plane": "runtime",
      "system_class": "runtime",
      "role": "agent-runtime",
      "lifecycle": "active",
      "owns": "Agent lifecycle, orchestration, dispatch, checkpoints, metering and observability.",
      "must_not_own": "AIE authority, Trust Gateway enforcement, WORKS durable execution, organizational canonical knowledge or independent verification."
    },
    {
      "name": "works-execution",
      "canonical_branch": "main",
      "visibility": "public",
      "architecture_plane": "execution",
      "system_class": "execution",
      "role": "durable-execution",
      "lifecycle": "active",
      "owns": "Durable work state, scheduling, workers, leases, recovery, execution evidence and quittance.",
      "must_not_own": "Agent persona, AIE authority semantics, Trust Gateway admission or independent verification."
    },
    {
      "name": "relay",
      "canonical_branch": "main",
      "visibility": "private",
      "architecture_plane": "experience",
      "system_class": "operator-plane",
      "role": "human-operator-plane",
      "lifecycle": "active",
      "owns": "Governed operator plane for supervising autonomous work across agents, missions, execution nodes, Runtime projection, and Aftergraph infrastructure.",
      "must_not_own": "Runtime authority, AIE semantics, Trust Gateway admission, WORKS durable execution, or independent verification verdicts."
    },
    {
      "name": "studio",
      "canonical_branch": "main",
      "visibility": "public",
      "architecture_plane": "experience",
      "system_class": "experience",
      "role": "primary-experience",
      "lifecycle": "active",
      "owns": "General-purpose human operating environment for Chat, Work, Space, control and evidence surfaces.",
      "must_not_own": "Tenant binding, authority truth, execution truth, verification truth or world truth."
    },
    {
      "name": "home-os",
      "canonical_branch": "main",
      "visibility": "private",
      "architecture_plane": "experience",
      "system_class": "operator-control-surface",
      "role": "primary-operator-control-surface",
      "lifecycle": "active",
      "owns": "Primary human operator/control surface, HomeOS navigation and workspace composition, governed projections for ToolFabric, compute, FIHIM, evidence and approval interaction.",
      "must_not_own": "AIE authority semantics, Trust Gateway admission or secrets, Runtime orchestration, WORKS durable execution truth, Sentinel verification truth, ToolFabric routing truth, or canonical repository topology truth."
    },
    {
      "name": "fihim",
      "canonical_branch": "main",
      "visibility": "private",
      "architecture_plane": "experience",
      "system_class": "personal-agent-environment",
      "role": "personal-agent-product",
      "lifecycle": "active",
      "owns": "Persistent personal intelligent-agent environment: identity/context continuity, agent coordination, user-facing conversational and delegated-work experiences, surfaced through HomeOS and other approved clients.",
      "must_not_own": "Primary operator control surface (HomeOS), canonical domain truth, AIE authority semantics, Trust Gateway admission/secrets, Runtime orchestration, WORKS durable execution/evidence, independent verification verdicts, Business Ops or tenant policy truth, or silent mock operational state."
    },
    {
      "name": "war-room",
      "canonical_branch": "main",
      "visibility": "public",
      "architecture_plane": "experience",
      "system_class": "ops-intelligence-projection",
      "role": "operational-intelligence-backend-projection",
      "lifecycle": "active",
      "owns": "Operational intelligence projection, organization reality queries, missions/agents/compute/attention/evidence aggregation and secondary diagnostic surfaces without inventing canonical state.",
      "must_not_own": "Primary operator/control interface (HomeOS), canonical repository topology truth, AIE authority, Trust Gateway admission/secrets, Runtime orchestration, WORKS durable execution/evidence, independent verification verdicts, or authoritative org-state generation."
    },
    {
      "name": "wi-backend",
      "canonical_branch": "main",
      "visibility": "public",
      "architecture_plane": "intelligence",
      "system_class": "work-intelligence",
      "role": "work-inference",
      "lifecycle": "active",
      "owns": "Source-neutral observation to canonical WorkItem inference, review, publication and promotion boundaries.",
      "must_not_own": "AIE authority and delegation, Trust Gateway admission, agent lifecycle and orchestration, durable execution or independent verification."
    },
    {
      "name": "wi-frontend",
      "canonical_branch": "main",
      "visibility": "private",
      "architecture_plane": "experience",
      "system_class": "specialist-experience",
      "role": "work-intelligence-experience",
      "lifecycle": "active",
      "owns": "Wie browser experience and least-privilege BFF consuming canonical Work Intelligence state from wi-backend.",
      "must_not_own": "Canonical WorkItem truth, which remains backend-owned, authority, admission, execution or verification."
    },
    {
      "name": "context-continuity",
      "canonical_branch": "main",
      "visibility": "private",
      "architecture_plane": null,
      "system_class": "continuity",
      "role": "continuity-contract",
      "lifecycle": "active",
      "owns": "Portable transfer of actionable context/state across model, agent, session and runtime boundaries.",
      "must_not_own": "Authority grants, execution truth, verification verdicts or durable mission state."
    },
    {
      "name": "continuum",
      "canonical_branch": "main",
      "visibility": "private",
      "architecture_plane": null,
      "system_class": "assurance",
      "role": "continuity-containment-verification",
      "lifecycle": "active",
      "owns": "Continuity and containment fault-injection campaigns and verification harnesses.",
      "must_not_own": "Ordinary execution-outcome verification verdicts, ISR canonical metrics or ordinary session continuity ownership."
    },
    {
      "name": "sentinel",
      "canonical_branch": "main",
      "visibility": "public",
      "architecture_plane": "verification",
      "system_class": "assurance",
      "role": "verified-code-review",
      "lifecycle": "active",
      "owns": "Exact-HEAD verified code-review verdicts with stale-base invalidation and cited evidence.",
      "must_not_own": "Execution of the work it verifies, authority semantics, enforcement or durable execution state."
    },
    {
      "name": "intelligence-systems-research",
      "canonical_branch": "main",
      "visibility": "public",
      "architecture_plane": null,
      "system_class": "research-assurance",
      "role": "research-assurance",
      "lifecycle": "active",
      "owns": "SPEC-001, MISSION-Bench methodology, scientific claims, experiments, assurance and publication evidence.",
      "must_not_own": "Runtime authority, enforcement, execution or production platform behavior."
    },
    {
      "name": "skills-vault",
      "canonical_branch": "main",
      "visibility": "private",
      "architecture_plane": null,
      "system_class": "capabilities",
      "role": "capability-supply-chain",
      "lifecycle": "active",
      "owns": "Governed skill discovery, trust, lifecycle, provenance, compatibility and distribution.",
      "must_not_own": "Execution authority, admission decisions, verification verdicts or model lifecycle truth."
    },
    {
      "name": "llm-research-development",
      "canonical_branch": "main",
      "visibility": "private",
      "architecture_plane": null,